1.开一台主机 node-1
1) node-1 ip 20.5.1.83

2.node-1上创建net namespace 模拟pod
ip netns add node-1-pod

3.node-1创建bridge
ip link add bridge-pod type bridge

4.node-1创建 vethpair对，一端在net namespace,一端在 bridge
ip link add podveth0 type veth peer name podveth1
ip link set podveth0 netns node-1-pod
ip link set dev podveth1 master bridge-pod

5.给node-1 bridge分配IP,并激活bridge
ip addr add 1.2.3.1/24 dev bridge-pod
ip link set bridge-pod up

6.进入node-1的 node-1-pod net namespace
1)激活loopback
ip netns exec node-1-pod ip link set dev lo up
2)激活veth pair node0veth0
ip netns exec node-1-pod ifconfig podveth0 1.2.3.100/24 up
3)node-1激活veth pair对端网卡
ip link set dev podveth1 up

7.为容器增加一个路由规则，让容器可以访问外面的网络
ip netns exec node-1-pod ip route add default via 1.2.3.1


测试：
1.ip netns exec node-1-pod ping www.baidu.com
结果：ping: www.baidu.com: 未知的名称或服务
问题分析：tcpdump抓包分析
listening on podveth0, link-type EN10MB (Ethernet), capture size 262144 bytes
16:12:44.648346 IP localhost.localdomain.42207 > 114.114.114.114.domain: 53236+ A? www.baidu.com. (31)
16:12:44.648733 IP localhost.localdomain.55719 > 114.114.114.114.domain: 49623+ PTR? 114.114.114.114.in-addr.arpa. (46)
16:12:49.655199 IP localhost.localdomain.34898 > 172.20.21.31.domain: 53236+ A? www.baidu.com. (31)
16:12:49.655512 IP localhost.localdomain.50945 > 172.20.21.31.domain: 49623+ PTR? 114.114.114.114.in-addr.arpa. (46)
16:12:49.660164 ARP, Request who-has gateway tell localhost.localdomain, length 28
16:12:49.660230 ARP, Reply gateway is-at 86:73:a8:64:55:8f (oui Unknown), length 28
16:12:54.661155 IP localhost.localdomain.42207 > 114.114.114.114.domain: 53236+ A? www.baidu.com. (31)
16:12:54.661460 IP localhost.localdomain.55719 > 114.114.114.114.domain: 49623+ PTR? 114.114.114.114.in-addr.arpa. (46)
16:12:59.667561 IP localhost.localdomain.34898 > 172.20.21.31.domain: 53236+ A? www.baidu.com. (31)
16:12:59.667604 IP localhost.localdomain.50945 > 172.20.21.31.domain: 49623+ PTR? 114.114.114.114.in-addr.arpa. (46)
16:13:04.669099 IP localhost.localdomain.55583 > 114.114.114.114.domain: 37762+ A? www.baidu.com.localdomain. (43)
16:13:04.670476 IP localhost.localdomain.49454 > 114.114.114.114.domain: 29506+ PTR? 100.3.2.1.in-addr.arpa. (40)
16:13:09.675913 IP localhost.localdomain.46737 > 172.20.21.31.domain: 37762+ A? www.baidu.com.localdomain. (43)
16:13:09.676330 IP localhost.localdomain.60900 > 172.20.21.31.domain: 29506+ PTR? 100.3.2.1.in-addr.arpa. (40)
16:13:14.679886 IP localhost.localdomain.55583 > 114.114.114.114.domain: 37762+ A? www.baidu.com.localdomain. (43)
16:13:14.679940 IP localhost.localdomain.49454 > 114.114.114.114.domain: 29506+ PTR? 100.3.2.1.in-addr.arpa. (40)
16:13:19.685746 IP localhost.localdomain.46737 > 172.20.21.31.domain: 37762+ A? www.baidu.com.localdomain. (43)
16:13:19.685805 IP localhost.localdomain.60900 > 172.20.21.31.domain: 29506+ PTR? 100.3.2.1.in-addr.arpa. (40)
16:13:24.691817 IP localhost.localdomain.57805 > 114.114.114.114.domain: 10455+ PTR? 31.21.20.172.in-addr.arpa. (43)
16:13:27.410430 IP localhost.localdomain.59297 > 114.114.114.114.domain: 60645+ A? www.baidu.com. (31)
16:13:29.692540 ARP, Request who-has gateway tell localhost.localdomain, length 28
16:13:29.692643 ARP, Reply gateway is-at 86:73:a8:64:55:8f (oui Unknown), length 28
16:13:29.692679 IP localhost.localdomain.53500 > 172.20.21.31.domain: 10455+ PTR? 31.21.20.172.in-addr.arpa. (43)
16:13:32.416207 IP localhost.localdomain.43068 > 172.20.21.31.domain: 60645+ A? www.baidu.com. (31)
16:13:34.699080 IP localhost.localdomain.57805 > 114.114.114.114.domain: 10455+ PTR? 31.21.20.172.in-addr.arpa. (43)
16:13:37.417856 IP localhost.localdomain.59297 > 114.114.114.114.domain: 60645+ A? www.baidu.com. (31)
16:13:39.705578 IP localhost.localdomain.53500 > 172.20.21.31.domain: 10455+ PTR? 31.21.20.172.in-addr.arpa. (43)
16:13:42.423479 IP localhost.localdomain.43068 > 172.20.21.31.domain: 60645+ A? www.baidu.com. (31)

2.解决方案
https://blog.csdn.net/WeiJiaXiaoBao/article/details/122325038